{"budget":{"estimated":262,"fits":true,"limit":5000,"minimumRequired":262},"complete":true,"coverage":{"candidates":13,"excluded":0,"included":13},"estimator":{"digest":"sha256:602e648c2ff7c58cace92876f6c834c5c1735ce594e3ba565d7b012f752fb0be","identity":"dev.lekalo.estimator.chars-4@0.2.16","version":"0.2.16"},"gaps":[{"gap":"detected-effects-absent"},{"gap":"error-contracts-unrepresentable"}],"identity":"dev.lekalo.context@0.2.16","irDigest":"sha256:2ed11578a45ee61635c51cc4ad5ff758db3bc2a23a867f0c70547c75188df8f7","manifest":{"excluded":[],"included":[{"id":"operation:planner.focus_task","section":"symbol","tokens":35},{"id":"policy:planner.deny_bulk_focus","section":"policies","tokens":21},{"id":"effect:create:operation:planner.focus_task->canonical:planner.task#0","section":"effects","tokens":18},{"id":"effect:emit-event:operation:planner.focus_task->event:planner.task_focused#0","section":"effects","tokens":20},{"id":"edge:accepts:operation:planner.focus_task->type:planner.task_id#0","section":"dependencies","tokens":18},{"id":"edge:derived_from:operation:planner.focus_task->requirement:PLANNER-REQ-001#0","section":"dependencies","tokens":21},{"id":"edge:references:operation:planner.focus_task->effect:planner.create_task#0","section":"dependencies","tokens":20},{"id":"scenario:planner.focus_flow","section":"scenarios","tokens":27},{"id":"edge:exposes:endpoint:planner.api_focus->operation:planner.focus_task#0","section":"public-impact","tokens":19},{"id":"target-binding:planner.binding_node","section":"bindings","tokens":13},{"id":"type:planner.task_id","section":"types","tokens":14},{"id":"edge:emits:effect:planner.create_task->event:planner.task_focused#0","section":"closure","tokens":18},{"id":"edge:references:effect:planner.create_task->entity:planner.task#0","section":"closure","tokens":18}]},"mode":"symbol","modelVersion":"0.2.16","project":"planner","roots":["operation:planner.focus_task"],"schemaVersion":"lekalo/context/v0.2.16","sections":{"bindings":[{"id":"target-binding:planner.binding_node","target":"node-typescript"}],"closure":[{"confidence":"canonical","from":"effect:planner.create_task","occurrence":0,"relation":"emits","to":"event:planner.task_focused"},{"confidence":"canonical","from":"effect:planner.create_task","occurrence":0,"relation":"references","to":"entity:planner.task"}],"dependencies":[{"confidence":"canonical","from":"operation:planner.focus_task","occurrence":0,"relation":"accepts","to":"type:planner.task_id"},{"confidence":"canonical","from":"operation:planner.focus_task","occurrence":0,"relation":"derived_from","to":"requirement:PLANNER-REQ-001"},{"confidence":"canonical","from":"operation:planner.focus_task","occurrence":0,"relation":"references","to":"effect:planner.create_task"}],"effects":[{"action":null,"confidence":"canonical","field":null,"kind":"create","occurrence":0,"operation":"operation:planner.focus_task","resource":{"id":"planner.task","kind":"canonical"}},{"action":null,"confidence":"canonical","field":null,"kind":"emit-event","occurrence":0,"operation":"operation:planner.focus_task","resource":{"id":"planner.task_focused","kind":"event"}}],"policies":[{"appliesTo":["planner.focus_task"],"decision":"deny","description":"Bulk focus is out of scope","id":"policy:planner.deny_bulk_focus"}],"public-impact":[{"confidence":"canonical","from":"endpoint:planner.api_focus","occurrence":0,"relation":"exposes","to":"operation:planner.focus_task"}],"scenarios":[{"covers":["planner.focus_task","planner.task_focused"],"id":"scenario:planner.focus_flow","summary":"Focusing a task emits the focused event."}],"symbol":[{"contract":{"effects":["planner.create_task"],"input":[{"name":"task_id","required":true,"type":{"ref":"planner.task_id"}}]},"derivedFrom":["PLANNER-REQ-001"],"description":"Focus one task","id":"operation:planner.focus_task","kind":"operation","module":"planner","subkind":"command","version":1}],"types":[{"contract":{"base":"uuid"},"description":"Stable task identifier","id":"type:planner.task_id","kind":"type","module":null,"version":1}]}}